{
  "$schema": "http://json-schema.org/draft-07/schema#",
  "title": "ChapterPackage",
  "type": "object",
  "required": [
    "chapterId",
    "book",
    "chapterNumber",
    "title",
    "targetLevel",
    "grammarFocus",
    "vocabulary",
    "exercises"
  ],
  "properties": {
    "chapterId": { "type": "string" },
    "book": { "type": "string" },
    "chapterNumber": { "type": "integer", "minimum": 1 },
    "title": { "type": "string" },
    "targetLevel": { "enum": ["A1", "A2", "B1", "B1+", "B2", "C1"] },
    "grammarFocus": {
      "type": "array",
      "items": { "type": "string" }
    },
    "vocabulary": {
      "type": "array",
      "minItems": 15,
      "maxItems": 30,
      "items": {
        "type": "object",
        "required": ["id", "term", "translation", "partOfSpeech", "example"],
        "properties": {
          "id": { "type": "string" },
          "term": { "type": "string" },
          "translation": { "type": "string" },
          "partOfSpeech": { "enum": ["noun", "verb", "adjective", "adverb", "phrase"] },
          "gender": { "enum": ["der", "die", "das", null] },
          "plural": { "type": "string" },
          "example": { "type": "string" }
        }
      }
    },
    "exercises": {
      "type": "object",
      "required": ["easy", "medium", "hard"],
      "properties": {
        "easy": {
          "type": "array",
          "minItems": 10,
          "maxItems": 15,
          "items": { "$ref": "#/definitions/exerciseItem" }
        },
        "medium": {
          "type": "array",
          "minItems": 10,
          "maxItems": 15,
          "items": { "$ref": "#/definitions/exerciseItem" }
        },
        "hard": {
          "type": "array",
          "minItems": 10,
          "maxItems": 15,
          "items": { "$ref": "#/definitions/exerciseItem" }
        }
      }
    }
  },
  "definitions": {
    "exerciseItem": {
      "type": "object",
      "required": ["id", "type", "instruction", "prompt", "solution", "explanation"],
      "properties": {
        "id": { "type": "string" },
        "type": {
          "enum": [
            "multiple-choice",
            "fill-in-blank",
            "sentence-scramble",
            "cloze-conjugation",
            "targeted-transformation",
            "error-correction"
          ]
        },
        "instruction": { "type": "string" },
        "prompt": { "type": "string" },
        "options": {
          "type": "array",
          "items": { "type": "string" }
        },
        "scrambleChunks": {
          "type": "array",
          "items": { "type": "string" }
        },
        "solution": { "type": "string" },
        "hint": { "type": "string" },
        "explanation": { "type": "string" }
      }
    }
  }
}
