{
  "chapterId": "momente-a2-2-l13",
  "book": "Momente A2.2 (Hueber Verlag)",
  "chapterNumber": 13,
  "title": "Ich gebe es ihm",
  "targetLevel": "A2",
  "grammarFocus": [
    "Wortstellung: Dativ- und Akkusativobjekt als Nomen",
    "Wortstellung: Akkusativpronomen vor Dativpronomen",
    "Ein Pronomen steht immer vor einem Nomen",
    "Ersetzung von Nomen durch Personalpronomen im Dativ und Akkusativ"
  ],
  "vocabulary": [
    { "id": "v01", "term": "schenken", "translation": "regalar", "partOfSpeech": "verb", "example": "Ich schenke meiner Freundin Blumen." },
    { "id": "v02", "term": "zeigen", "translation": "mostrar", "partOfSpeech": "verb", "example": "Ich zeige dem Geschäftspartner das Büro." },
    { "id": "v03", "term": "empfehlen", "translation": "recomendar", "partOfSpeech": "verb", "example": "Ich empfehle meiner Kollegin ein Buch." },
    { "id": "v04", "term": "schicken", "translation": "enviar", "partOfSpeech": "verb", "example": "Ich schicke meinem Freund eine Nachricht." },
    { "id": "v05", "term": "backen", "translation": "hornear", "partOfSpeech": "verb", "example": "Ich backe meinem Nachbarn einen Kuchen." },
    { "id": "v06", "term": "leihen", "translation": "prestar", "partOfSpeech": "verb", "example": "Ich leihe meinem Bruder mein Fahrrad." },
    { "id": "v07", "term": "erklären", "translation": "explicar", "partOfSpeech": "verb", "example": "Sie erklärt den Kollegen die neue Software." },
    { "id": "v08", "term": "erzählen", "translation": "contar (una historia)", "partOfSpeech": "verb", "example": "Er erzählt seinen Freunden eine spannende Geschichte." },
    { "id": "v09", "term": "das Geschenk", "translation": "el regalo", "partOfSpeech": "noun", "gender": "das", "plural": "die Geschenke", "example": "Das Geschenk hat ihr sehr gut gefallen." },
    { "id": "v10", "term": "die Nachricht", "translation": "el mensaje", "partOfSpeech": "noun", "gender": "die", "plural": "die Nachrichten", "example": "Ich habe dir gestern eine Nachricht geschickt." },
    { "id": "v11", "term": "das Rezept", "translation": "la receta", "partOfSpeech": "noun", "gender": "das", "plural": "die Rezepte", "example": "Kannst du mir dein Rezept für den Kuchen geben?" },
    { "id": "v12", "term": "der Nachbar", "translation": "el vecino", "partOfSpeech": "noun", "gender": "der", "plural": "die Nachbarn", "example": "Unser Nachbar ist sehr freundlich." },
    { "id": "v13", "term": "die Kollegin", "translation": "la colega", "partOfSpeech": "noun", "gender": "die", "plural": "die Kolleginnen", "example": "Meine Kollegin hilft mir oft." },
    { "id": "v14", "term": "der Geschäftspartner", "translation": "el socio comercial", "partOfSpeech": "noun", "gender": "der", "plural": "die Geschäftspartner", "example": "Der Geschäftspartner kommt morgen zu Besuch." },
    { "id": "v15", "term": "die Suppe", "translation": "la sopa", "partOfSpeech": "noun", "gender": "die", "plural": "die Suppen", "example": "Ich koche meiner Freundin eine Suppe." },
    { "id": "v16", "term": "die Tochter", "translation": "la hija", "partOfSpeech": "noun", "gender": "die", "plural": "die Töchter", "example": "Ich kaufe meiner Tochter neue Schuhe." },
    { "id": "v17", "term": "der Ball", "translation": "la pelota", "partOfSpeech": "noun", "gender": "der", "plural": "die Bälle", "example": "Ich gebe meinem Freund den Ball zurück." },
    { "id": "v18", "term": "die Oma", "translation": "la abuela", "partOfSpeech": "noun", "gender": "die", "plural": "die Omas", "example": "Ich bringe meiner Oma das Gemüse vom Markt." },
    { "id": "v19", "term": "freundlich", "translation": "amable", "partOfSpeech": "adjective", "example": "Unser neuer Kollege ist sehr freundlich." },
    { "id": "v20", "term": "dankbar", "translation": "agradecido", "partOfSpeech": "adjective", "example": "Ich bin dir wirklich dankbar für deine Hilfe." }
  ],
  "exercises": {
    "easy": [
      { "id": "e01", "type": "multiple-choice", "instruction": "Wähle die richtige Wortstellung.", "prompt": "Ich schenke ___. (meiner Freundin / Blumen)", "options": ["meiner Freundin Blumen", "Blumen meiner Freundin", "Blumen ihr", "sie meiner Freundin"], "solution": "meiner Freundin Blumen", "hint": "Bei zwei Nomen steht das Dativobjekt vor dem Akkusativobjekt.", "explanation": "Stehen beide Objekte als Nomen im Satz, kommt das Dativobjekt vor dem Akkusativobjekt: meiner Freundin (Dativ) Blumen (Akkusativ)." },
      { "id": "e02", "type": "multiple-choice", "instruction": "Wähle die richtige Wortstellung.", "prompt": "Ich schenke ___. (sie / ihr, beide als Pronomen)", "options": ["sie ihr", "ihr sie", "sie ihre", "ihr ihre"], "solution": "sie ihr", "hint": "Bei zwei Pronomen steht das Akkusativpronomen vor dem Dativpronomen.", "explanation": "Sind beide Objekte Pronomen, steht das Akkusativpronomen vor dem Dativpronomen: sie (Akkusativ) ihr (Dativ)." },
      { "id": "e03", "type": "multiple-choice", "instruction": "Wähle das richtige Pronomen.", "prompt": "Ich zeige es ___. (dem Geschäftspartner)", "options": ["ihm", "ihn", "ihr", "sie"], "solution": "ihm", "hint": "'der Geschäftspartner' ist maskulin.", "explanation": "Das Dativpronomen für maskuline Nomen (der Geschäftspartner → er) lautet 'ihm'." },
      { "id": "e04", "type": "multiple-choice", "instruction": "Wähle das richtige Pronomen.", "prompt": "Ich backe ihn ___. (meinem Nachbarn)", "options": ["ihm", "ihn", "ihr", "es"], "solution": "ihm", "hint": "'der Nachbar' ist maskulin.", "explanation": "Das Dativpronomen für maskuline Nomen (der Nachbar → er) lautet 'ihm'." },
      { "id": "e05", "type": "multiple-choice", "instruction": "Wähle das richtige Pronomen.", "prompt": "Ich empfehle es ___. (meiner Kollegin)", "options": ["ihr", "ihm", "sie", "es"], "solution": "ihr", "hint": "'die Kollegin' ist feminin.", "explanation": "Das Dativpronomen für feminine Nomen (die Kollegin → sie) lautet 'ihr'." },
      { "id": "e06", "type": "fill-in-blank", "instruction": "Ersetze das Akkusativobjekt durch das passende Pronomen.", "prompt": "Ich backe meinem Nachbarn einen Kuchen. → Ich backe ihm ___.", "solution": "ihn", "hint": "'der Kuchen' ist maskulin.", "explanation": "Das Akkusativpronomen für maskuline Nomen (der Kuchen → er) lautet 'ihn'." },
      { "id": "e07", "type": "fill-in-blank", "instruction": "Ersetze das Akkusativobjekt durch das passende Pronomen.", "prompt": "Ich schenke meiner Freundin Blumen. → Ich schenke ihr ___.", "solution": "sie", "hint": "'die Blumen' ist Plural.", "explanation": "Das Akkusativpronomen für Plural-Nomen (die Blumen → sie) lautet ebenfalls 'sie'." },
      { "id": "e08", "type": "fill-in-blank", "instruction": "Ersetze das Akkusativobjekt durch das passende Pronomen.", "prompt": "Ich zeige dem Geschäftspartner das Büro. → Ich zeige ihm ___.", "solution": "es", "hint": "'das Büro' ist neutral.", "explanation": "Das Akkusativpronomen für neutrale Nomen (das Büro → es) lautet 'es'." },
      { "id": "e09", "type": "multiple-choice", "instruction": "Wähle die richtige Wortstellung.", "prompt": "Ich koche ___. (meiner Freundin / eine Suppe)", "options": ["meiner Freundin eine Suppe", "eine Suppe meiner Freundin", "sie meiner Freundin", "ihr sie"], "solution": "meiner Freundin eine Suppe", "hint": "Bei zwei Nomen steht das Dativobjekt vor dem Akkusativobjekt.", "explanation": "Stehen beide Objekte als Nomen im Satz, kommt das Dativobjekt vor dem Akkusativobjekt." },
      { "id": "e10", "type": "multiple-choice", "instruction": "Wähle die richtige Wortstellung.", "prompt": "Ich koche ___. (sie / ihr, beide als Pronomen)", "options": ["sie ihr", "ihr sie", "sie ihre", "ihre sie"], "solution": "sie ihr", "hint": "Bei zwei Pronomen steht das Akkusativpronomen vor dem Dativpronomen.", "explanation": "Bei zwei Pronomen steht das Akkusativpronomen vor dem Dativpronomen: sie (Akkusativ) ihr (Dativ)." },
      { "id": "e11", "type": "multiple-choice", "instruction": "Wähle das richtige Pronomen.", "prompt": "Ich kaufe meiner Tochter die Schuhe. → Ich kaufe ___ die Schuhe.", "options": ["ihr", "sie", "ihm", "es"], "solution": "ihr", "hint": "'die Tochter' ist feminin.", "explanation": "Das Dativpronomen für feminine Nomen (die Tochter → sie) lautet 'ihr'." },
      { "id": "e12", "type": "fill-in-blank", "instruction": "Ersetze das Dativobjekt durch das passende Pronomen.", "prompt": "Ich bringe meiner Oma das Gemüse. → Ich bringe ___ das Gemüse.", "solution": "ihr", "hint": "'die Oma' ist feminin.", "explanation": "Das Dativpronomen für feminine Nomen (die Oma → sie) lautet 'ihr'." }
    ],
    "medium": [
      { "id": "m01", "type": "sentence-scramble", "instruction": "Bilde einen Satz. Achte auf die Reihenfolge der Objekte.", "prompt": "Baue den Satz aus den Wörtern.", "scrambleChunks": ["Ich", "schenke", "meiner", "Freundin", "Blumen"], "solution": "Ich schenke meiner Freundin Blumen.", "hint": "Dativobjekt vor Akkusativobjekt.", "explanation": "Bei zwei Nomen steht das Dativobjekt (meiner Freundin) vor dem Akkusativobjekt (Blumen)." },
      { "id": "m02", "type": "sentence-scramble", "instruction": "Bilde einen Satz. Achte auf die Reihenfolge der Pronomen.", "prompt": "Baue den Satz aus den Wörtern.", "scrambleChunks": ["Ich", "schenke", "sie", "ihr"], "solution": "Ich schenke sie ihr.", "hint": "Akkusativpronomen vor Dativpronomen.", "explanation": "Bei zwei Pronomen steht das Akkusativpronomen (sie) vor dem Dativpronomen (ihr)." },
      { "id": "m03", "type": "sentence-scramble", "instruction": "Bilde einen Satz mit einem Pronomen und einem Nomen.", "prompt": "Baue den Satz aus den Wörtern.", "scrambleChunks": ["Ich", "zeige", "ihm", "das", "Büro"], "solution": "Ich zeige ihm das Büro.", "hint": "Ein Pronomen steht immer vor einem Nomen.", "explanation": "Ein Pronomen (ihm) steht immer vor einem Nomen (das Büro), unabhängig vom Kasus." },